{
  "_meta": {
    "file": "dungeons.json",
    "version": 1,
    "owner": "systems-designer",
    "task": "P1-F03-T06, P1-H03 (coverageFilter, hpSafety copy variables), P1-X04 (_nullMeans, emergencyClose, safety, coverageFilter walk / shape / entrance keys), P2-F05-T20 (movementGate filter, runState hysteresis, openingHours), P2-F05-T01 (safety per D-061 change, rewardTick grants)",
    "doc": "design/systems/balance-model.md section 9; tools/coverage/METHOD.md 8.2",
    "readBy": ["tools/coverage (area limits, A-P1-PLAN-01-5; coverageFilter)","back office polygon validation", "server run state machine"]
  },
  "area": {
    "_source": "GDD > พื้นที่เล่นและ Dungeon > การกำหนด dungeon; ระบบหลังบ้าน > Validation ตอนวาด dungeon (3,000-150,000 ตร.ม.)",
    "minArea_m2": 3000,
    "maxArea_m2": 150000,
    "outOfRangeAction": "warn"
  },
  "levelRange": {
    "_source": "GDD > พื้นที่เล่นและ Dungeon > ระดับเลเวลที่เหมาะสม (กำหนดเป็นช่วง เช่น 15-25 ไม่บล็อกการเข้า)",
    "rangeRequired": true,
    "blockEntryOutsideRange": false,
    "exampleRangeWidth_levels": 10
  },
  "entry": {
    "_source": "GDD > พื้นที่เล่นและ Dungeon > การเข้าและออก (อยู่ได้ทีละ 1 dungeon, popup confirm ก่อนเข้าเสมอ)",
    "maxActiveDungeonsPerPlayer": 1,
    "confirmPopupRequired": true,
    "respectOpeningHours": true
  },
  "openingHours": {
    "_source": "GDD > พื้นที่เล่นและ Dungeon > เวลาทำการ; ความปลอดภัยทางกายภาพ (ไม่ให้มีคนไปปีนรั้วตอนดึก) · spec F04 R25-R30 · ADR 0003 9.2 · tech note F04 8.2-8.3 · P2-F05-T20",
    "utcOffset_min": 420,
    "_utcOffset_source": "Asia/Bangkok = UTC+07:00 all year, no daylight saving. Runtime evaluates local time as now_ms + utcOffset_min x 60,000 and never uses the device time zone",
    "closingSoonNotice_s": 600,
    "_closingSoonNotice_source": "Spec F04 section 8: early enough to finish a tick and walk out. 600 s >= movementGate.window_s (300 s, one full reward window) + about 3 min to walk out of the largest dungeon (area.maxArea_m2 150,000 m2 = radius about 220 m at 1.3 m/s). A window still open at closing time is paid by D-059 (emergencyClose partial tick), so the notice never costs a tick"
  },
  "runState": {
    "_source": "GDD > พื้นที่เล่นและ Dungeon > การเข้าและออก (Active / Grace ไม่เกิน 3 นาที / Suspended 3-15 นาที / Ended เกิน 15 นาที)",
    "graceMax_s": 180,
    "suspendedMax_s": 900,
    "rewardTickDuringGrace": false,
    "rewardTickDuringSuspended": false,
    "suspendedTimeCounts": false,
    "_note": "Outside time <= 180 s = Grace; 180-900 s = Suspended; > 900 s = Ended. The same 15-minute limit ends a run on connection loss (GDD > สถาปัตยกรรมเทคนิค > สัญญาณขาดและแอปถูกปิด)",
    "edgeHysteresisSamples": 6,
    "edgeHysteresis_m": 5,
    "_edgeHysteresis_source": "P2-F05-T20 · spec F04 R15 (GD B-05) limits: distance <= about 1/3 of the 31 m radius of the smallest dungeon and below half of a 20 m riverside strip; confirmation time (samples x movementGate.sampleCadence_s = 6 x 5 = 30 s) <= graceMax_s / 6 = 30 s. Evidence: tools/sim report-gate section 3 (edge-walk trace: the 2 real exits give Grace 140 s and Suspended at 180.001 s; drift exits all < 180 s)",
    "_edgeHysteresis_rule": "Confirmed reading (answers A-P2-F04-T14-1 and A-P2-F04-T12-2): pending run = consecutive usable samples observed on the other side of the polygon edge; a usable sample on the confirmed side resets it. A sample counts only when boundaryDistance_m > edgeHysteresis_m; samples inside that band neither count nor reset. The change is confirmed after edgeHysteresisSamples counted samples (both conditions together, not either) and takes effect at the FIRST sample of the pending run, band samples included (F04 R14). Same rule outward and inward. edgeHysteresis_m = 0 means count only; edgeHysteresisSamples = 1 means distance only. A sample pair gap > movementGate.maxSamplePairGap_s drops a pending run",
    "pastRunSummariesKept": 10,
    "_pastRunSummariesKept_source": "P2-X17 · J-P2-T30-3 item 5 (design/reviews/F05-F06-flow-approval.md: the count of past runs kept is config, not hardcoded, NN-3). Count of the most recent ended-run summaries (RunSummary: dungeonId, exitReason, start/end time, ticks, loot, exp) kept on the device for home.recentRunsShortcut; the oldest is dropped when a new run ends. 10 = about a week at the GDD pace (40 min/day, 1-2 runs a day). Privacy bound: a summary never holds coordinates, a route or a map (F05-R25, NN-4); it is wiped by the local-data delete (G4) and by account deletion. dungeonId + time is a coarse visit history, so this value must stay <= whatever limit the PDPA sign-off sets for on-device history; raise it only with that sign-off",
    "clockSkewTolerance_s": 5,
    "_clockSkewTolerance_source": "P2-F05-T20 · spec F04 E10 (not so long that it becomes extra play time), tech note F04 4.2 / 4.4: a sample more than 5 s in the future is rejected, now_ms going back more than 5 s ends the run with clock_invalid. 5 s covers fix-timestamp vs Date.now differences and small NTP steps on one device clock"
  },
  "rewardTick": {
    "_source": "GDD > Core loop ใน Dungeon > Reward tick (ให้ของเป็นขั้นทุก 5 นาที)",
    "rewardTickInterval_s": 300,
    "seeExpCurve": "progression.json#expCurve",
    "seeDropTables": "drops.json#dropTables",
    "_grants_note": "P2-F05-T01 (spec F05 R10-R17, D-094): a tick that passed the movement gate grants exp and one loot roll at once; a denied tick grants nothing and draws no random number. exp = expPerTick(Z) x expMultiplier (Magic term, level-gap term) x f, where Z = combat.json#monsterAttack.zoneLevelFrom, f = 1 for a normal tick and e / movementGate.window_s for a D-059 partial tick. exp is kept unrounded (the client shows the floor); level-ups apply at once and may chain; at progression.json#level.maxLevel no exp is added. exp is not run loot (kept on death). Loot = rollTickLoot(runSeed, grantedCount, dropTables[drop_table_id], multipliers, f) into the run bag. Formulas: design/systems/balance-model.md section 17; vectors: design/systems/test-vectors/tick-reward.json"
  },
  "movementGate": {
    "_source": "GDD > Core loop ใน Dungeon > Movement gate (ระยะทางสะสมเกิน 50 เมตรใน 5 นาที ใช้ทั้ง dungeon และ raid ไม่มีข้อยกเว้น)",
    "minDistancePerWindow_m": 50,
    "window_s": 300,
    "comparison": "greaterThan",
    "appliesTo": ["dungeon", "raid"],
    "exceptions": [],
    "sampleCadence_s": 5,
    "maxSamplePairGap_s": 30,
    "maxSampleAccuracy_m": 30,
    "outlierSpeed_kmh": 60,
    "outlierReanchorSamples": 5,
    "_filter_source": "P2-F05-T20 · ADR 0003 5.3 / 5.5 (names), spec F05 section 8 and F04 section 8 (limits). Evidence: tools/sim report-gate sections 1-2",
    "_sampleCadence_source": "window_s % sampleCadence_s = 0 (300 / 5). On the 1 Hz synthetic traces: table-still 0/3 reward windows pass (max 3.3 m), bench-jitter 3/3 pass (53.4-56.5 m, narrow margin, finding F-16), park-loop 6/6 (388-398 m). 10 s fails bench-jitter (0/3). 5 s equals the 0.2 Hz sample period, so a 0.2 Hz device and a 1 Hz device on the same walk give the same grid (vector movement-gate 1 Hz vs 0.2 Hz)",
    "_maxSamplePairGap_source": "GD B-04: long enough for a 0.2 Hz device (5 s) and short GPS dropouts under trees (soi trace gaps up to 25 s), much shorter than runState.graceMax_s (180 s = 6 x 30 s), short enough that a 5-minute gap walked 400 m adds 0 m. Also the no-evidence limit (F04 R13) and the settled-horizon lag of the engine",
    "_maxSampleAccuracy_source": "Spec F05 section 8: not stricter than anticheat.checkIn.maxAccuracy_m (30, strict less-than). Gate keeps accuracy <= 30 (equal is kept), so it is never stricter than check-in. Separate key by ADR 0003 5.5; intentionally the same number",
    "_outlierSpeed_source": "Impossible for a walker, yet above GPS jitter at 1 Hz: synthetic-warmup-accuracy-01 (accuracy settling from 30 to 6 m) has 1 Hz jitter pairs up to 134 km/h; at 30 km/h (the location-engineer fixture) 52 of its fixes are dropped and the check-in approach never reaches 60 s in the 5-minute trace, at 60 km/h 4 are dropped and the approach completes at 118 s (ideal about 106 s). Spikes stay caught: drift-spike S2 1,080 km/h, S3 snap-back 216 km/h at 1 Hz, teleport 4,904 km/h. Separate from anticheat.speedLock.speedLock_kmh (25): the speed lock uses unfiltered pairs, and a pair faster than speedLock_kmh adds no gate distance anyway (tech note F05 3.1 item 5), so a higher outlierSpeed_kmh never adds reward distance. Evidence: tools/sim report-gate section 2",
    "_outlierReanchorSamples_source": "Longer than the 3-fix spike of synthetic-drift-spike-01 (S2, 300 m at accuracy 12 m) so a spike never becomes the anchor; 5 s at 1 Hz, 25 s at 0.2 Hz before a real relocation (GPS back after a building) is accepted",
    "_assumption": "A-P2-F05-T20-1: all five filter values are proposals from synthetic traces only; real-device jitter (P2-C03, TL N-11) may move sampleCadence_s. If a phone lying still passes the gate after filtering, the orchestrator opens a fix task for systems-designer and informs game-director before P2-F05-T16 (board rule 4). Owner: systems-designer, game-director"
  },
  "hpSafety": {
    "_source": "GDD > HP การตาย และการฟื้นฟู > ระบบกันตาย",
    "autoRetreatEnabledByDefault": true,
    "autoRetreatThreshold_pct": 25,
    "autoRetreatKeepsRunLoot": true,
    "lowHpWarningThreshold_pct": 30,
    "lowHpWarningChannels": ["vibrate", "push"],
    "_copyVariables": {
      "autoRetreatPct": "autoRetreatThreshold_pct",
      "hpWarnPct": "lowHpWarningThreshold_pct"
    },
    "_note": "P1-H03: copy variables {autoRetreatPct} and {hpWarnPct} (style-guide 4.1) read these keys; the formatter prints the integer as is (25, 30)"
  },
  "death": {
    "_source": "GDD > HP การตาย และการฟื้นฟู > เมื่อตาย",
    "loseAllRunLoot": true,
    "supportReviveOnlyInsideSameDungeon": true
  },
  "exit": {
    "_source": "GDD > HP การตาย และการฟื้นฟู > การออกจาก dungeon (กดออกได้ทุกเมื่อ ระบบเริ่มฟื้น HP ทันที)",